{
  "id": "loot.test_boss",
  "kind": "loot_table",
  "displayName": "Cave Boss",
  "ownershipPolicy": "ground_free",
  "entries": [
    {
      "itemDefinitionId": "item.test_relic_blade",
      "minimumQuantity": 1,
      "maximumQuantity": 1,
      "chance": 1,
      "guaranteed": true
    },
    {
      "itemDefinitionId": "item.test_potion",
      "minimumQuantity": 1,
      "maximumQuantity": 2,
      "chance": 0.4
    }
  ]
}
